{
  "schema_version": 1,
  "minimum_reader_version": "0.4.0",
  "mode": "turn_index",
  "project_id": "project-visible",
  "provider": "codex",
  "session_id": "01234567-0123-4567-89ab-0123456789ab",
  "generation_id": "generation-visible",
  "session_view_digest": "sha256:aaaaaaaaaaaaaaaaaaaaaaaaaaaaaaaaaaaaaaaaaaaaaaaaaaaaaaaaaaaaaaaa",
  "dependency_digest": "sha256:bbbbbbbbbbbbbbbbbbbbbbbbbbbbbbbbbbbbbbbbbbbbbbbbbbbbbbbbbbbbbbbb",
  "redaction_version": "visible-redaction-v1",
  "turn_unit_id": null,
  "total": 0,
  "range_start": 0,
  "range_end": 0,
  "first_cursor": null,
  "previous_cursor": null,
  "next_cursor": null,
  "last_cursor": null,
  "turn_units": [],
  "messages": [],
  "coverage": {
    "source_records": 1,
    "visible_messages": 0,
    "captured_messages": 0,
    "truncated_messages": 0,
    "truncated_bodies": 0,
    "context_messages": 0,
    "orphan_messages": 0,
    "oversized_records": 0,
    "malformed_records": 0,
    "complete": true
  }
}
